TITLE,DOI,YEAR
Cyanobacteria-mediated phenylpropanoids and phytohormones in rice (Oryza sativa) enhance plant growth and stress tolerance,10.1007/s10482-011-9611-0,2011
Plant growth-promoting bacteria as a tool to improve salinity tolerance in sweet pepper,10.1071/FP11173,2011
Drying-rewetting cycles affect fungal and bacterial growth differently in an arable soil,10.1007/s00248-010-9723-5,2010
Climate change effects on beneficial plant-microorganism interactions,10.1111/j.1574-6941.2010.00900.x,2010
"Endophytic bacteria improve seedling growth of sunflower under water stress, produce salicylic acid, and inhibit growth of pathogenic fungi",10.1007/s00284-010-9642-1,2010
"Drought-tolerant plant growth promoting Bacillus spp.: effect on growth, osmolytes, and antioxidant status of maize under drought stress",10.1080/17429145.2010.535178,2010
Combination of endophytic and rhizospheric plant growth promoting rhizobacteria in Oryza sativa shows higher accumulation of osmoprotectant against saline stress,10.1007/s11738-010-0604-9,2010
Soil beneficial bacteria and their role in plant growth promotion: a review,10.1007/s13213-010-0117-1,2010
"Piriformospora indica confers drought tolerance in Chinese cabbage leaves by stimulating antioxidant enzymes, the expression of drought-related genes and the plastid-localized CAS protein",10.1016/j.jplph.2010.02.013,2010
Regulation of plasma membrane aquaporins by inoculation with a Bacillus megaterium strain in maize (Zea mays L.) plants under unstressed and salt-stressed conditions,10.1007/s00425-010-1196-8,2010
Growth promotion and protection against salt stress by Pseudomonas putida Rs-198 on cotton,10.1016/j.ejsobi.2009.11.002,2010
Ectomycorrhizal fungal communities associated with Pinus thunbergii in the eastern coastal pine forests of Korea,10.1007/s00572-009-0262-1,2009
Salt tolerance in Zea mays (L). following inoculation with Rhizobium and Pseudomonas,10.1007/s00374-008-0344-9,2009
Comparative effectiveness of Pseudomonas and Serratia sp. containing ACC-deaminase for improving growth and yield of wheat (Triticum aestivum L.) under salt-stressed conditions,10.1007/s00203-009-0466-y,2009
Rhizobacteria containing ACC-deaminase confer salt tolerance in maize grown on salt-affected fields,https://doi.org/10.1139/W09-092,2009
Pseudomonas sp. strain AKM-P6 enhances tolerance of sorghum seedlings to elevated temperatures,10.1007/s00374-009-0404-9,2009
Improvement of Salt Tolerance Mechanisms of Barley Cultivated Under Salt Stress Using Azospirillum brasilense,10.1007/978-1-4020-9065-3_15,2009
Phosphate solubilizing microorganisms isolated from rhizosphere of maize cultivated in an oxisol of the Brazilian Cerrado Biome,10.1016/j.soilbio.2008.01.012,2009
Enhanced phytoextraction of an agricultural Cr- and Pb-contaminated soil by bioaugmentation with siderophore-producing bacteria,10.1016/j.chemosphere.2008.09.013,2009
Rhizosphere bacteria containing 1-aminocyclopropane-1-carboxylate deaminase increase yield of plants grown in drying soil via both local and systemic hormone signalling,10.1111/j.1469-8137.2008.02657.x,2009
Alleviation of drought stress effects in sunflower seedlings by the exopolysaccharides producing Pseudomonas putida strain GAP-P45,10.1007/s00374-009-0401-z,2009
Mechanisms of salinity tolerance,10.1146/annurev.arplant.59.032607.092911,2008
Effect of Rhizobium–Azospirillum coinoculation on nitrogen fixation and yield of two contrasting Phaseolus vulgaris L. genotypes cultivated across different environments in Cuba,10.1007/s11104-008-9606-4,2008
Salt tolerance of barley induced by the root endophyte Piriformospora indica is associated with a strong increase in antioxidants,10.1111/j.1469-8137.2008.02583.x,2008
Effect of Azospirillum brasilense coinoculated with Rhizobium on Phaseolus vulgaris flavonoids and Nod factor production under salt stress,/10.1016/j.soilbio.2008.06.016,2008
Soil bacteria confer plant salt tolerance by tissue-specific regulation of the sodium transporter HKT1,10.1094/MPMI-21-6-0737,2008
Protection against pathogen and salt stress by four plant growth-promoting rhizobacteria isolated from Pinus sp. on Arabidopsis thaliana,10.1094/PHYTO-98-6-0666,2008
Alleviation of drought stress in the common bean (Phaseolus vulgaris L.) by co-inoculation with Paenibacillus polymyxa and Rhizobium tropici,10.1016/j.apsoil.2008.04.005,2008
Mycorrhizal and non-mycorrhizal Lactuca sativa plants exhibit contrasting responses to exogenous ABA during drought stress and recovery,10.1093/jxb/ern057,2008
"2R,3R-butanediol, a bacterial volatile produced by Pseudomonas chlororaphis O6, is involved in induction of systemic tolerance to drought in Arabidopsis thaliana",10.1094/MPMI-21-8-1067,2008
Ectomycorrhizal community structure in a xeric Quercus woodland based on rDNA sequence analysis of sporocarps and pooled roots,10.1111/j.1469-8137.2007.02040.x,2007
Influence of arbuscular mycorrhizal mycelial exudates on soil bacterial growth and community structure,10.1111/j.1574-6941.2007.00337.x,2007
A virus in a fungus in a plant: three-way symbiosis required for thermal tolerance,10.1126/science.1136237,2007
Preliminary investigations on inducing salt tolerance in maize through inoculation with rhizobacteria containing ACC deaminase activity,10.1139/W07-081,2007
Drought tolerance and antioxidant activities in lavender plants colonized by native drought-tolerant or drought-sensitive Glomus Species,10.1007/s00248-007-9237-y,2007
Metal tolerating methylotrophic bacteria reduces nickel and cadmium toxicity and promotes plant growth of tomato (Lycopersicon esculentum L),10.1016/j.chemosphere.2007.04.017,2007
Cytokinin producing bacteria enhance plant growth in drying soil,10.1007/s11104-007-9233-5,2007
Pseudomonas brassicacearum strain Am3 containing 1-aminocyclopropane-1-carboxylate deaminase can show both pathogenic and growth-promoting properties in its interaction with tomato,10.1093/jxb/erm010,2007
"How does arbuscular mycorrhizal symbiosis regulate root hydraulic properties and plasma membrane aquaporins in Phaseolus vulgaris under drought, cold or salinity stresses?",10.1111/j.1469-8137.2006.01961.x,2007
Improved growth of salinity-stressed soybean after inoculation with salt pre-treated mycorrhizal fungi,10.1016/j.jplph.2006.06.016,2007
Increasing NaCl – Salt Tolerance of a Halophytic Plant Phragmites australis by Mycorrhizal Symbiosis,10.5555/20073256420,2007
"Enhancement of chilling resistance of inoculated grapevine plantlets with a plant growth-promoting rhizobacterium, Burkholderia phytofirmans strain PsJN",10.1128/AEM.01047-06,2006
Seed inoculation with Azospirillum mitigates NaCl effects on lettuce,10.1016/j.scienta.2006.02.025,2006
Effects of drought on isolates of Bradyrhizobium elkanii cultured from Albizia adianthifolia seedlings of different provenances,10.1007/s10457-006-9025-6,2006
Alleviation of salt stress in Lotus glaber by Glomus intraradices,10.1007/s11104-006-9015-5,2006
Influence of arbuscular mycorrhizal fungi and kinetin on the response of mungbean plants to irrigation with seawater,10.1007/s00572-004-0345-y,2005
Water relations and yield in Azospirillum-inoculated wheat exposed to drought in the field,10.1139/b03-119,2004
Inoculating wheat seedlings with exopolysaccharide-producing bacteria restricts sodium uptake and stimulates plant growth under salt stress,10.1007/s00374-004-0766-y,2004
Mechanisms of salt tolerance and interactive effects of Azospirillum brasilense inoculation on maize cultivars grown under salt stress conditions,10.1023/B:GROW.0000049414.03099.9b,2004
Plant growth-promoting bacteria confer resistance in tomato plants to salt stress,10.1016/j.plaphy.2004.05.009,2004
"Arbuscular mycorrhizal influence on leaf water potential, solute accumulation, and oxidative stress in soybean plants subjected to drought stress",10.1093/jxb/erh188,2004
Influence of growth-promoting bacteria on the growth of wheat in different soils and temperatures,10.1016/S0038-0717(03)00158-5,2003
Experimental and mathematical simulation of plant growth promoting rhizobacteria and plant interaction under cadmium stress,10.1023/A:1019941525758,2002
Rhizosphere soil aggregation and plant growth promotion of sunflowers by an exopolysaccharide-producing Rhizobium sp. strain isolated from sunflower roots,10.1128/AEM.66.8.3393-3398.2000,2000
Effects of Azospirillum brasilense on root morphology of common bean (Phaseolus vulgaris L.) under different water regimes,10.1007/s003740000245,2000
Alleviation of water stress effects in cowpea by Bradyrhizobium spp. inoculation,10.1023/A:1004403918379,1999
The plant-growth-promoting rhizobacterium Paenibacillus polymyxa induces changes in Arabidopsis thaliana gene expression: a possible connection between biotic and abiotic stress responses,10.1094/MPMI.1999.12.11.951,1999
Colonization of wheat roots by an exopolysaccharide-producing pantoea agglomerans strain and its effect on rhizosphere soil aggregation,10.1128/AEM.64.10.3740-3747.1998,1998
